{
  "schema": "facia.answer-set/2",
  "question": "Is the release ready to approve?",
  "answerType": "verdict",
  "path": "execution",
  "inspection": "available",
  "actionable": true,
  "items": [
    {
      "type": "Verdict",
      "contract": "BoundedVerdictV1",
      "payload": { "release": "v2", "risk": "low" },
      "state": "ready",
      "conforms": true,
      "evidence": ["test-report"]
    }
  ],
  "operations": [
    {
      "id": "approve",
      "label": "Approve release",
      "invocation": "host-callback",
      "reference": "release.approve",
      "confirmation": "Approve this release?"
    },
    {
      "id": "return",
      "label": "Return for changes",
      "invocation": "model-operation",
      "reference": "release.return"
    }
  ],
  "density": 1
}
